{
  "$schema": "http://json-schema.org/draft-07/schema#",
  "type": "object",
  "title": "Emotion Values & CME Configuration",
  "required": [
    "emotion_values",
    "emotion_prompts",
    "emotional_states"
  ],
  "properties": {
    "emotion_values": {
      "type": "array",
      "title": "Emotion Value Dimensions",
      "items": {
        "type": "object",
        "required": [
          "id",
          "description",
          "ge",
          "le"
        ],
        "properties": {
          "id": {
            "type": "string",
            "title": "Dimension ID"
          },
          "description": {
            "type": "string",
            "title": "Description"
          },
          "ge": {
            "type": "number",
            "title": "Minimum Value (ge)",
            "default": 0.0
          },
          "le": {
            "type": "number",
            "title": "Maximum Value (le)",
            "default": 1.0
          }
        }
      }
    },
    "emotion_prompts": {
      "type": "object",
      "title": "Emotion Character Prompts",
      "additionalProperties": {
        "type": "string"
      }
    },
    "emotional_states": {
      "type": "object",
      "title": "Emotional States Configuration",
      "additionalProperties": {
        "$ref": "#/definitions/emotionalStateRule"
      }
    },
    "emotion_colors": {
      "type": "object",
      "title": "Emotion Colors",
      "additionalProperties": {
        "type": "string"
      }
    },
    "emotion_delta_rules": {
      "$ref": "#/definitions/emotionDeltaRules"
    },
    "pitch_tuning": {
      "$ref": "#/definitions/pitchTuning"
    }
  },
  "definitions": {
    "pitchTuning": {
      "type": "object",
      "title": "Pitch Tuning (D38)",
      "description": "Tuning numbers for the merged pitch phase: dialogue-option emotion effects, veto/objection thresholds, and grudge lifetime. All optional - omitted fields fall back to the pre-D38 hardcoded values.",
      "properties": {
        "emotion_stonewall": { "type": "number", "title": "Stonewall: hit to the objecting stakeholder", "default": -0.10 },
        "emotion_stonewall_ally": { "type": "number", "title": "Stonewall: gain to the opposing side", "default": 0.05 },
        "emotion_reframe": { "type": "number", "title": "Reframe: gain to the objecting stakeholder", "default": 0.02 },
        "emotion_addendum": { "type": "number", "title": "Emergency Addendum: hit to the objecting stakeholder", "default": -0.15 },
        "emotion_concede": { "type": "number", "title": "Concede Correction: hit to the objecting stakeholder", "default": -0.05 },
        "emotion_veto_breaker": { "type": "number", "title": "Veto Breaker: hit to the overridden stakeholder", "default": -0.40 },
        "emotion_concede_win": { "type": "number", "title": "Let Them Have It (D41): gain to the side that gets its way", "default": 0.30 },
        "emotion_concede_lose": { "type": "number", "title": "Let Them Have It (D41): hit to the side whose card was dropped", "default": -0.20 },
        "secondary_malus": { "type": "number", "title": "Fit penalty vs. a stakeholder's secondary priority", "default": 0.15 },
        "veto_threshold": { "type": "number", "title": "Buy-in floor below which a high-power stakeholder vetoes", "default": 0.4 },
        "objection_threshold": { "type": "number", "title": "Buy-in floor below which a low-power stakeholder objects", "default": 0.3 },
        "loss_w": { "type": "number", "title": "Weight of accumulated loss in the buy-in formula", "default": 0.3 },
        "grudge_lifetime": { "type": "integer", "title": "Simulations a grudge keeps firing before it is spent", "default": 2 },
        "challenge_recovery": { "type": "number", "title": "Share of the way back to neutral every emotion recovers when the next challenge begins", "default": 0.25 },
        "reframe_hit": { "type": "number", "title": "Fit at/above this on Reframe is a Direct Hit (D48)", "default": 0.7 },
        "reframe_partial": { "type": "number", "title": "Fit at/above this (below Hit) on Reframe is a Partial (D48)", "default": 0.4 },
        "room_listen": { "type": "number", "title": "Fit below which other high-power seats turn colder on a Reframe (D48)", "default": 0.35 },
        "emotion_reframe_miss": { "type": "number", "title": "Reframe Miss: hit to the objecting stakeholder, now hardened", "default": -0.08 },
        "emotion_room_listening": { "type": "number", "title": "Reframe: hit to other high-power seats with a poor fit", "default": -0.03 },
        "default_patience": { "type": "integer", "title": "Patience per stakeholder per challenge (D50)", "default": 3 },
        "sound_out_patience_cost": { "type": "integer", "title": "Patience spent sounding a stakeholder out in Build your case (D50)", "default": 1 },
        "impatience_step": { "type": "number", "title": "Emotion offset of the first impatience step when a standing objection is re-pitched unanswered", "default": 0.15 },
        "impatience_cap": { "type": "integer", "title": "Most impatience steps one stakeholder can carry in a challenge", "default": 3 },
        "impatience_decay": { "type": "number", "title": "Diminishing growth factor between impatience steps", "default": 0.6 },
        "impatience_relief": { "type": "number", "title": "Trust and fairness gain when a standing objection is answered", "default": 0.08 },
        "case_board_attempts": { "type": "integer", "title": "Case board: wrong or empty guesses allowed per challenge", "default": 5 },
        "ally_lift": { "type": "number", "title": "Case board: trust and fairness lift for a confirmed ally, once per pitch", "default": 0.05 },
        "pep_talk_confidence_gain": { "type": "number", "title": "Pep-Talk: confidence gain per stakeholder, scaled by reactivity", "default": 0.08 },
        "pep_talk_control_gain": { "type": "number", "title": "Pep-Talk: sense-of-control gain per stakeholder, scaled by reactivity", "default": 0.05 },
        "pen_enabled": { "type": "boolean", "title": "Hand the Pen: whether the card can be played", "default": true },
        "pen_leave_player_slots": { "type": "integer", "title": "Hand the Pen: slots that must still be free after a draft is added", "default": 0 },
        "pen_trust_gain": {
          "type": "object",
          "title": "Hand the Pen: trust gain to the holder when the card is played, per trust band",
          "properties": {
            "low": { "type": "number", "default": 0.12 },
            "medium": { "type": "number", "default": 0.07 },
            "high": { "type": "number", "default": 0.03 }
          },
          "default": { "low": 0.12, "medium": 0.07, "high": 0.03 }
        },
        "pen_control_gain": {
          "type": "object",
          "title": "Hand the Pen: sense-of-control gain to the holder when the card is played, per trust band",
          "properties": {
            "low": { "type": "number", "default": 0.12 },
            "medium": { "type": "number", "default": 0.07 },
            "high": { "type": "number", "default": 0.03 }
          },
          "default": { "low": 0.12, "medium": 0.07, "high": 0.03 }
        },
        "pen_trust_dividend_steps": { "type": "integer", "title": "Hand the Pen: most rungs a High-trust draft can move in one slot", "default": 2 },
        "pen_holder_fairness_cost": { "type": "number", "title": "Hand the Pen: fairness the holder loses for doing the PM's work, scaled by reactivity", "default": 0.04 },
        "pen_room_fairness_cost": { "type": "number", "title": "Hand the Pen: fairness every other stakeholder loses, scaled by reactivity", "default": 0.03 }
      }
    },
    "emotionDeltaRules": {
      "type": "object",
      "title": "Emotion Delta Rules",
      "properties": {
        "intel_rules": {
          "type": "object",
          "title": "Intel Delta Rules",
          "properties": {
            "misattributed_intel": {
              "type": "object",
              "title": "Misattributed Intel Penalties",
              "additionalProperties": {
                "type": "number"
              }
            },
            "correct_intel": {
              "type": "object",
              "title": "Correct Intel Rewards",
              "additionalProperties": {
                "type": "number"
              }
            }
          }
        }
      }
    },
    "emotionalStateRule": {
      "type": "object",
      "title": "State Rule",
      "required": [
        "conditions",
        "formula"
      ],
      "properties": {
        "facial_expression": {
          "type": "string",
          "title": "Avatar Facial Expression",
          "default": "smile"
        },
        "color": {
          "type": "string",
          "title": "Hex Color Code"
        },
        "conditions": {
          "type": "array",
          "title": "Trigger Conditions",
          "items": {
            "type": "object",
            "required": [
              "metric",
              "op",
              "value"
            ],
            "properties": {
              "metric": {
                "type": "string",
                "title": "Metric ID"
              },
              "op": {
                "type": "string",
                "title": "Operator",
                "enum": [
                  "<=",
                  ">=",
                  "<",
                  ">",
                  "=="
                ]
              },
              "value": {
                "type": "number",
                "title": "Threshold Value"
              }
            }
          }
        },
        "formula": {
          "type": "object",
          "title": "Intensity Formula",
          "required": [
            "type"
          ],
          "properties": {
            "type": {
              "type": "string",
              "title": "Formula Type",
              "enum": [
                "weighted_sum",
                "constant"
              ]
            },
            "value": {
              "type": "number",
              "title": "Constant Value"
            },
            "weights": {
              "type": "array",
              "title": "Weights",
              "items": {
                "type": "object",
                "required": [
                  "metric",
                  "weight"
                ],
                "properties": {
                  "metric": {
                    "type": "string",
                    "title": "Metric ID"
                  },
                  "weight": {
                    "type": "number",
                    "title": "Weight"
                  },
                  "invert": {
                    "type": "boolean",
                    "title": "Invert (1.0 - value)",
                    "default": false
                  }
                }
              }
            }
          }
        }
      }
    }
  }
}
